{
  "$schema": "./planner-stage-1-1-canonicalization.manifest.schema.json",
  "artifactId": "planner.stage-1-1.canonicalization.manifest",
  "schemaVersion": 1,
  "status": "proposed",
  "lastReviewed": "2026-03-18",
  "humanProposalPath": "packages/@dvt/planner/docs/planning/Stage-1.1-Planner-Canonicalization.md",
  "structuredArtifactPath": "docs/planning/proposals/planner-stage-1-1-canonicalization.manifest.json",
  "legacyMarkdownCompanionPath": "packages/@dvt/planner/docs/planning/Stage-1.1-Planner-Canonicalization.machine-readable.md",
  "legacyMarkdownCompanionStatus": "replaced_by_manifest",
  "policyBoundary": {
    "humanProposalIsPolicyAuthority": true,
    "divergenceRule": "human_proposal_wins_until_synchronized",
    "structuredArtifactMayIntroduceNewSubstantiveDecisions": false,
    "structuredArtifactPurpose": [
      "deterministic section lookup",
      "deterministic decision extraction",
      "deterministic gap extraction",
      "deterministic artifact tracing",
      "repository-validated machine navigation"
    ]
  },
  "locationState": {
    "currentPrimaryHumanArtifactPath": "packages/@dvt/planner/docs/planning/Stage-1.1-Planner-Canonicalization.md",
    "currentStructuredArtifactPath": "docs/planning/proposals/planner-stage-1-1-canonicalization.manifest.json",
    "targetPrimaryArtifactPaths": [
      "docs/architecture/planner/**",
      "docs/contracts/planner/**",
      "docs/planning/proposals/**"
    ]
  },
  "sourceBasis": {
    "activeGovernance": [
      "docs/planning/status/governance-document-rule-inventory.md",
      "docs/guides/ai-work-protocol.md",
      "docs/adr/ADR-0005-contract-formalization-tooling.md",
      "docs/adr/ADR-0006-contract-tooling-governance.md",
      "docs/adr/ADR-0035-planner-public-contract-evolution-protocol.md"
    ],
    "designSources": [
      "packages/@dvt/planner/docs/planning/Stage-1.1-Planner-Canonicalization.md",
      "docs/planning/archive/proposals/principal-architecture-review-execution-plan-20260317.md",
      "docs/planning/reviews/20260316-principal-architecture-review.md",
      "docs/architecture/engine/contracts/engine/IWorkflowEngine.v2.0.md",
      "docs/architecture/engine/contracts/capabilities/README.md"
    ],
    "historicalContext": ["docs/archive/DVT+_Architectural_Review_20260225.md"]
  },
  "sectionIndex": [
    { "id": "S-01", "title": "Purpose", "humanSection": "1" },
    { "id": "S-02", "title": "Problem Statement", "humanSection": "2" },
    { "id": "S-03", "title": "Architectural Baseline", "humanSection": "3" },
    { "id": "S-04", "title": "Decision Criteria", "humanSection": "4" },
    {
      "id": "S-05",
      "title": "Architectural Style Constraints",
      "humanSection": "5"
    },
    { "id": "S-06", "title": "Current Duplication", "humanSection": "6" },
    { "id": "S-07", "title": "ExecutionPlanV2 Ownership", "humanSection": "7" },
    {
      "id": "S-08",
      "title": "PlannerInputEnvelopeV2 Ownership",
      "humanSection": "8"
    },
    {
      "id": "S-09",
      "title": "IExecutionPlanner Ownership",
      "humanSection": "9"
    },
    {
      "id": "S-10",
      "title": "Planner Internal Types Boundary",
      "humanSection": "10"
    },
    {
      "id": "S-11",
      "title": "Public vs Internal Planner Surfaces",
      "humanSection": "11"
    },
    { "id": "S-12", "title": "Planner Purity Boundary", "humanSection": "12" },
    {
      "id": "S-13",
      "title": "Policy vs Runtime Enforcement Split",
      "humanSection": "13"
    },
    { "id": "S-14", "title": "Input Envelope Strategy", "humanSection": "14" },
    {
      "id": "S-15",
      "title": "manifestRef Resolution Contract",
      "humanSection": "15"
    },
    {
      "id": "S-16",
      "title": "compiledCodeRef Placement",
      "humanSection": "16"
    },
    { "id": "S-17", "title": "Executability Gate", "humanSection": "17" },
    {
      "id": "S-18",
      "title": "stepId to nodeId Relationship",
      "humanSection": "18"
    },
    { "id": "S-19", "title": "Unknown StepKind Policy", "humanSection": "19" },
    {
      "id": "S-20",
      "title": "custom Passthrough Policy",
      "humanSection": "20"
    },
    { "id": "S-21", "title": "Schema Authority", "humanSection": "21" },
    { "id": "S-22", "title": "ADR Policy", "humanSection": "22" },
    {
      "id": "S-23",
      "title": "Documentation Placement Policy",
      "humanSection": "23"
    },
    {
      "id": "S-24",
      "title": "Contract Evolution, Owners, and Delivery Gates",
      "humanSection": "24"
    },
    { "id": "S-25", "title": "Migration Plan", "humanSection": "25" },
    {
      "id": "S-26",
      "title": "Critical Follow-On Contract Gaps",
      "humanSection": "26"
    },
    { "id": "S-27", "title": "Concrete Examples", "humanSection": "27" },
    { "id": "S-28", "title": "Artifacts To Update", "humanSection": "28" },
    {
      "id": "S-29",
      "title": "Recommended Output Artifacts",
      "humanSection": "29"
    },
    {
      "id": "S-30",
      "title": "Residual Non-Blocking Questions",
      "humanSection": "30"
    },
    { "id": "S-31", "title": "Acceptance Criteria", "humanSection": "31" },
    { "id": "S-32", "title": "Final Recommendations", "humanSection": "32" },
    { "id": "S-33", "title": "Implementation Order", "humanSection": "33" },
    { "id": "S-34", "title": "Non-Goals", "humanSection": "34" }
  ],
  "diagramRefs": [
    {
      "id": "DG-01",
      "title": "Target-State Component View",
      "humanSection": "5",
      "diagramType": "mermaid-graph"
    },
    {
      "id": "DG-02",
      "title": "Domain View",
      "humanSection": "5",
      "diagramType": "mermaid-classDiagram"
    },
    {
      "id": "DG-03",
      "title": "Target-State Sequence View",
      "humanSection": "5",
      "diagramType": "mermaid-sequenceDiagram"
    }
  ],
  "decisionIndex": [
    {
      "id": "D-01",
      "title": "ExecutionPlanV2 Ownership",
      "humanSectionRefs": ["7", "24"],
      "policyStatus": "selected",
      "decisionClass": "canonical_ownership"
    },
    {
      "id": "D-02",
      "title": "PlannerInputEnvelopeV2 Ownership",
      "humanSectionRefs": ["8", "14", "24"],
      "policyStatus": "selected",
      "decisionClass": "canonical_ownership"
    },
    {
      "id": "D-03",
      "title": "IExecutionPlanner Ownership",
      "humanSectionRefs": ["9", "24"],
      "policyStatus": "selected",
      "decisionClass": "canonical_ownership"
    },
    {
      "id": "D-04",
      "title": "Planner Internal Types Boundary",
      "humanSectionRefs": ["10", "11"],
      "policyStatus": "selected",
      "decisionClass": "boundary_rule"
    },
    {
      "id": "D-05",
      "title": "Planner Purity Boundary",
      "humanSectionRefs": ["12", "13"],
      "policyStatus": "selected",
      "decisionClass": "boundary_rule"
    },
    {
      "id": "D-06",
      "title": "Input Envelope Strategy",
      "humanSectionRefs": ["14"],
      "policyStatus": "selected_with_gap",
      "decisionClass": "boundary_rule"
    },
    {
      "id": "D-07",
      "title": "manifestRef Resolution",
      "humanSectionRefs": ["15"],
      "policyStatus": "selected_with_gap",
      "decisionClass": "boundary_rule"
    },
    {
      "id": "D-08",
      "title": "compiledCodeRef Placement",
      "humanSectionRefs": ["16"],
      "policyStatus": "selected",
      "decisionClass": "boundary_rule"
    },
    {
      "id": "D-09",
      "title": "Executability Gate",
      "humanSectionRefs": ["17"],
      "policyStatus": "selected_with_gap",
      "decisionClass": "boundary_rule"
    },
    {
      "id": "D-10",
      "title": "stepId to nodeId Transitional Policy",
      "humanSectionRefs": ["18"],
      "policyStatus": "selected_target_state_pending",
      "decisionClass": "boundary_rule"
    },
    {
      "id": "D-11",
      "title": "Unknown StepKind Policy",
      "humanSectionRefs": ["19"],
      "policyStatus": "selected_with_gap",
      "decisionClass": "boundary_rule"
    },
    {
      "id": "D-12",
      "title": "custom Passthrough Policy",
      "humanSectionRefs": ["20"],
      "policyStatus": "selected_with_gap",
      "decisionClass": "boundary_rule"
    },
    {
      "id": "D-13",
      "title": "Schema Authority and Documentation Placement",
      "humanSectionRefs": ["21", "22", "23", "24", "25", "28", "31"],
      "policyStatus": "proposed_plan",
      "decisionClass": "documentation_policy"
    }
  ],
  "illustrativeShapes": [
    {
      "id": "IS-01",
      "title": "ExecutionBindingVerificationResult",
      "humanSectionRefs": ["16"],
      "status": "illustrative_until_canonized",
      "ownerToCanonize": "@dvt/contracts engine boundary"
    },
    {
      "id": "IS-02",
      "title": "ExecutabilityValidationResult Fields",
      "humanSectionRefs": ["17"],
      "status": "illustrative_until_canonized",
      "ownerToCanonize": "@dvt/contracts engine boundary"
    }
  ],
  "gapRegister": [
    {
      "id": "G-01.1",
      "title": "Executability validation contract",
      "severity": "high",
      "currentState": "canonicalized",
      "closedBy": "packages/@dvt/contracts/src/contracts/planner/PlanExecutabilityValidation.v1.ts",
      "requiredArtifacts": [
        "@dvt/contracts definition for validation result",
        "@dvt/engine contract surface for validatePlan or equivalent"
      ]
    },
    {
      "id": "G-01.2",
      "title": "Artifact resolver port interface",
      "severity": "high",
      "currentState": "canonicalized",
      "closedBy": "packages/@dvt/planner/src/ports/IArtifactResolver.ts",
      "requiredArtifacts": [
        "planner boundary contract or application service boundary doc"
      ]
    },
    {
      "id": "G-01.3",
      "title": "custom namespace registration model",
      "severity": "high",
      "currentState": "canonicalized",
      "closedBy": "packages/@dvt/contracts/src/contracts/planner/CustomPolicyNamespaceRegistry.v1.ts",